{"generated_at":"2026-10-20T23:16:57+0000","season":2026,"records":[{"team":"Afturelding","points":45,"probability":1},{"team":"Fylkir","points":40,"probability":1},{"team":"Grindavík","points":25,"probability":1},{"team":"Grótta","points":27,"probability":1},{"team":"HK","points":38,"probability":1},{"team":"Leiknir R.","points":28,"probability":1},{"team":"Njarðvík","points":38,"probability":1},{"team":"Vestri","points":27,"probability":1},{"team":"Völsungur","points":26,"probability":1},{"team":"Ægir","points":9,"probability":1},{"team":"ÍR","points":28,"probability":1},{"team":"Þróttur R.","points":43,"probability":1}],"summary":[{"team":"Afturelding","mean_points":45,"median_points":45,"lower_80":45,"upper_80":45,"base_points":45,"p_top_six":1,"p_winner":1,"p_relegation":0},{"team":"Fylkir","mean_points":40,"median_points":40,"lower_80":40,"upper_80":40,"base_points":40,"p_top_six":1,"p_winner":0,"p_relegation":0},{"team":"Grindavík","mean_points":25,"median_points":25,"lower_80":25,"upper_80":25,"base_points":25,"p_top_six":0,"p_winner":0,"p_relegation":1},{"team":"Grótta","mean_points":27,"median_points":27,"lower_80":27,"upper_80":27,"base_points":27,"p_top_six":0,"p_winner":0,"p_relegation":0},{"team":"HK","mean_points":38,"median_points":38,"lower_80":38,"upper_80":38,"base_points":38,"p_top_six":1,"p_winner":0,"p_relegation":0},{"team":"Leiknir R.","mean_points":28,"median_points":28,"lower_80":28,"upper_80":28,"base_points":28,"p_top_six":1,"p_winner":0,"p_relegation":0},{"team":"Njarðvík","mean_points":38,"median_points":38,"lower_80":38,"upper_80":38,"base_points":38,"p_top_six":1,"p_winner":0,"p_relegation":0},{"team":"Vestri","mean_points":27,"median_points":27,"lower_80":27,"upper_80":27,"base_points":27,"p_top_six":0,"p_winner":0,"p_relegation":0},{"team":"Völsungur","mean_points":26,"median_points":26,"lower_80":26,"upper_80":26,"base_points":26,"p_top_six":0,"p_winner":0,"p_relegation":0},{"team":"Ægir","mean_points":9,"median_points":9,"lower_80":9,"upper_80":9,"base_points":9,"p_top_six":0,"p_winner":0,"p_relegation":1},{"team":"ÍR","mean_points":28,"median_points":28,"lower_80":28,"upper_80":28,"base_points":28,"p_top_six":0,"p_winner":0,"p_relegation":0},{"team":"Þróttur R.","mean_points":43,"median_points":43,"lower_80":43,"upper_80":43,"base_points":43,"p_top_six":1,"p_winner":0,"p_relegation":0}]}
