{"generated_at":"2026-10-17T17:16:55+0000","season":2026,"records":[{"team":"Afturelding","points":22,"probability":1},{"team":"Augnablik","points":16,"probability":1},{"team":"Dalvík/Reynir","points":14,"probability":1},{"team":"Einherji","points":27,"probability":1},{"team":"Fjölnir","points":28,"probability":1},{"team":"Fylkir","points":26,"probability":1},{"team":"KFR","points":8,"probability":1},{"team":"KÞ","points":13,"probability":1},{"team":"Smári","points":1,"probability":1},{"team":"Vestri","points":27,"probability":1},{"team":"Álftanes","points":2,"probability":1},{"team":"ÍR","points":5,"probability":1}],"summary":[{"team":"Afturelding","mean_points":22,"median_points":22,"lower_80":22,"upper_80":22,"base_points":22,"p_top_six":1,"p_winner":0,"p_relegation":0},{"team":"Augnablik","mean_points":16,"median_points":16,"lower_80":16,"upper_80":16,"base_points":16,"p_top_six":1,"p_winner":0,"p_relegation":0},{"team":"Dalvík/Reynir","mean_points":14,"median_points":14,"lower_80":14,"upper_80":14,"base_points":14,"p_top_six":0,"p_winner":0,"p_relegation":0},{"team":"Einherji","mean_points":27,"median_points":27,"lower_80":27,"upper_80":27,"base_points":27,"p_top_six":1,"p_winner":0,"p_relegation":0},{"team":"Fjölnir","mean_points":28,"median_points":28,"lower_80":28,"upper_80":28,"base_points":28,"p_top_six":1,"p_winner":1,"p_relegation":0},{"team":"Fylkir","mean_points":26,"median_points":26,"lower_80":26,"upper_80":26,"base_points":26,"p_top_six":1,"p_winner":0,"p_relegation":0},{"team":"KFR","mean_points":8,"median_points":8,"lower_80":8,"upper_80":8,"base_points":8,"p_top_six":0,"p_winner":0,"p_relegation":0},{"team":"KÞ","mean_points":13,"median_points":13,"lower_80":13,"upper_80":13,"base_points":13,"p_top_six":0,"p_winner":0,"p_relegation":0},{"team":"Smári","mean_points":1,"median_points":1,"lower_80":1,"upper_80":1,"base_points":1,"p_top_six":0,"p_winner":0,"p_relegation":1},{"team":"Vestri","mean_points":27,"median_points":27,"lower_80":27,"upper_80":27,"base_points":27,"p_top_six":1,"p_winner":0,"p_relegation":0},{"team":"Álftanes","mean_points":2,"median_points":2,"lower_80":2,"upper_80":2,"base_points":2,"p_top_six":0,"p_winner":0,"p_relegation":1},{"team":"ÍR","mean_points":5,"median_points":5,"lower_80":5,"upper_80":5,"base_points":5,"p_top_six":0,"p_winner":0,"p_relegation":0}]}
