{"generated_at":"2026-10-22T23:51:37+0000","season":2026,"records":[{"team":"Breiðablik","points":36,"probability":0.56075},{"team":"Breiðablik","points":37,"probability":0.1755},{"team":"Breiðablik","points":39,"probability":0.26375},{"team":"FH","points":30,"probability":0.1145},{"team":"FH","points":31,"probability":0.159},{"team":"FH","points":33,"probability":0.7265},{"team":"Fram","points":46,"probability":0.74525},{"team":"Fram","points":47,"probability":0.13875},{"team":"Fram","points":49,"probability":0.116},{"team":"KA","points":26,"probability":0.28425},{"team":"KA","points":27,"probability":0.2375},{"team":"KA","points":29,"probability":0.47825},{"team":"KR","points":53,"probability":0.26375},{"team":"KR","points":54,"probability":0.1755},{"team":"KR","points":56,"probability":0.56075},{"team":"Keflavík","points":29,"probability":0.594},{"team":"Keflavík","points":30,"probability":0.21075},{"team":"Keflavík","points":32,"probability":0.19525},{"team":"Stjarnan","points":31,"probability":0.364},{"team":"Stjarnan","points":32,"probability":0.20425},{"team":"Stjarnan","points":34,"probability":0.43175},{"team":"Valur","points":34,"probability":0.43175},{"team":"Valur","points":35,"probability":0.20425},{"team":"Valur","points":37,"probability":0.364},{"team":"Víkingur R.","points":63,"probability":0.116},{"team":"Víkingur R.","points":64,"probability":0.13875},{"team":"Víkingur R.","points":66,"probability":0.74525},{"team":"ÍA","points":37,"probability":0.19525},{"team":"ÍA","points":38,"probability":0.21075},{"team":"ÍA","points":40,"probability":0.594},{"team":"ÍBV","points":22,"probability":0.47825},{"team":"ÍBV","points":23,"probability":0.2375},{"team":"ÍBV","points":25,"probability":0.28425},{"team":"Þór","points":27,"probability":0.7265},{"team":"Þór","points":28,"probability":0.159},{"team":"Þór","points":30,"probability":0.1145}],"summary":[{"team":"Breiðablik","mean_points":36.96675,"median_points":36,"lower_80":36,"upper_80":39,"base_points":36,"p_top_six":1,"p_winner":0,"p_relegation":0},{"team":"FH","mean_points":32.3385,"median_points":33,"lower_80":30,"upper_80":33,"base_points":30,"p_top_six":0,"p_winner":0,"p_relegation":0},{"team":"Fram","mean_points":46.48675,"median_points":46,"lower_80":46,"upper_80":49,"base_points":46,"p_top_six":1,"p_winner":0,"p_relegation":0},{"team":"KA","mean_points":27.67225,"median_points":27,"lower_80":26,"upper_80":29,"base_points":26,"p_top_six":0,"p_winner":0,"p_relegation":0.40225},{"team":"KR","mean_points":54.85775,"median_points":56,"lower_80":53,"upper_80":56,"base_points":53,"p_top_six":1,"p_winner":0,"p_relegation":0},{"team":"Keflavík","mean_points":29.7965,"median_points":29,"lower_80":29,"upper_80":32,"base_points":29,"p_top_six":1,"p_winner":0,"p_relegation":0},{"team":"Stjarnan","mean_points":32.4995,"median_points":32,"lower_80":31,"upper_80":34,"base_points":31,"p_top_six":0,"p_winner":0,"p_relegation":0},{"team":"Valur","mean_points":35.29625,"median_points":35,"lower_80":34,"upper_80":37,"base_points":34,"p_top_six":0,"p_winner":0,"p_relegation":0},{"team":"Víkingur R.","mean_points":65.3745,"median_points":66,"lower_80":63,"upper_80":66,"base_points":63,"p_top_six":1,"p_winner":1,"p_relegation":0},{"team":"ÍA","mean_points":38.99275,"median_points":40,"lower_80":37,"upper_80":40,"base_points":37,"p_top_six":1,"p_winner":0,"p_relegation":0},{"team":"ÍBV","mean_points":23.09025,"median_points":23,"lower_80":22,"upper_80":25,"base_points":22,"p_top_six":0,"p_winner":0,"p_relegation":1},{"team":"Þór","mean_points":27.5025,"median_points":27,"lower_80":27,"upper_80":30,"base_points":27,"p_top_six":0,"p_winner":0,"p_relegation":0.59775}]}
