{"generated_at":"2026-04-29T10:59:34+0000","season":2026,"records":[{"team":"Breiðablik","points":3,"probability":0.0005},{"team":"Breiðablik","points":4,"probability":0.00225},{"team":"Breiðablik","points":5,"probability":0.00175},{"team":"Breiðablik","points":6,"probability":0.01925},{"team":"Breiðablik","points":7,"probability":0.035},{"team":"Breiðablik","points":8,"probability":0.01875},{"team":"Breiðablik","points":9,"probability":0.15475},{"team":"Breiðablik","points":10,"probability":0.19},{"team":"Breiðablik","points":12,"probability":0.57775},{"team":"FH","points":1,"probability":0.02},{"team":"FH","points":2,"probability":0.0455},{"team":"FH","points":3,"probability":0.03575},{"team":"FH","points":4,"probability":0.116},{"team":"FH","points":5,"probability":0.16025},{"team":"FH","points":6,"probability":0.0745},{"team":"FH","points":7,"probability":0.20275},{"team":"FH","points":8,"probability":0.1825},{"team":"FH","points":10,"probability":0.16275},{"team":"Fram","points":0,"probability":0.31175},{"team":"Fram","points":1,"probability":0.2075},{"team":"Fram","points":2,"probability":0.03725},{"team":"Fram","points":3,"probability":0.245},{"team":"Fram","points":4,"probability":0.11175},{"team":"Fram","points":5,"probability":0.0035},{"team":"Fram","points":6,"probability":0.07325},{"team":"Fram","points":7,"probability":0.00675},{"team":"Fram","points":9,"probability":0.00325},{"team":"Grindavík/Njarðvík","points":0,"probability":0.12575},{"team":"Grindavík/Njarðvík","points":1,"probability":0.1325},{"team":"Grindavík/Njarðvík","points":2,"probability":0.05525},{"team":"Grindavík/Njarðvík","points":3,"probability":0.29925},{"team":"Grindavík/Njarðvík","points":4,"probability":0.18025},{"team":"Grindavík/Njarðvík","points":5,"probability":0.03275},{"team":"Grindavík/Njarðvík","points":6,"probability":0.112},{"team":"Grindavík/Njarðvík","points":7,"probability":0.0445},{"team":"Grindavík/Njarðvík","points":9,"probability":0.01775},{"team":"Stjarnan","points":0,"probability":0.11025},{"team":"Stjarnan","points":1,"probability":0.129},{"team":"Stjarnan","points":2,"probability":0.058},{"team":"Stjarnan","points":3,"probability":0.18775},{"team":"Stjarnan","points":4,"probability":0.1825},{"team":"Stjarnan","points":5,"probability":0.05325},{"team":"Stjarnan","points":6,"probability":0.13675},{"team":"Stjarnan","points":7,"probability":0.08975},{"team":"Stjarnan","points":9,"probability":0.05275},{"team":"Valur","points":3,"probability":0.05325},{"team":"Valur","points":4,"probability":0.08075},{"team":"Valur","points":5,"probability":0.04475},{"team":"Valur","points":6,"probability":0.13825},{"team":"Valur","points":7,"probability":0.16575},{"team":"Valur","points":8,"probability":0.06575},{"team":"Valur","points":9,"probability":0.15925},{"team":"Valur","points":10,"probability":0.13225},{"team":"Valur","points":11,"probability":0.02075},{"team":"Valur","points":12,"probability":0.0975},{"team":"Valur","points":13,"probability":0.02725},{"team":"Valur","points":15,"probability":0.0145},{"team":"Víkingur R.","points":3,"probability":0.073},{"team":"Víkingur R.","points":4,"probability":0.0945},{"team":"Víkingur R.","points":5,"probability":0.03725},{"team":"Víkingur R.","points":6,"probability":0.191},{"team":"Víkingur R.","points":7,"probability":0.14625},{"team":"Víkingur R.","points":8,"probability":0.046},{"team":"Víkingur R.","points":9,"probability":0.1595},{"team":"Víkingur R.","points":10,"probability":0.0935},{"team":"Víkingur R.","points":11,"probability":0.0195},{"team":"Víkingur R.","points":12,"probability":0.08525},{"team":"Víkingur R.","points":13,"probability":0.03075},{"team":"Víkingur R.","points":15,"probability":0.0235},{"team":"ÍBV","points":3,"probability":0.01375},{"team":"ÍBV","points":4,"probability":0.02175},{"team":"ÍBV","points":5,"probability":0.0145},{"team":"ÍBV","points":6,"probability":0.053},{"team":"ÍBV","points":7,"probability":0.0735},{"team":"ÍBV","points":8,"probability":0.04725},{"team":"ÍBV","points":9,"probability":0.0975},{"team":"ÍBV","points":10,"probability":0.12225},{"team":"ÍBV","points":11,"probability":0.06025},{"team":"ÍBV","points":12,"probability":0.11675},{"team":"ÍBV","points":13,"probability":0.12775},{"team":"ÍBV","points":14,"probability":0.0405},{"team":"ÍBV","points":15,"probability":0.09625},{"team":"ÍBV","points":16,"probability":0.06175},{"team":"ÍBV","points":18,"probability":0.05325},{"team":"Þróttur R.","points":0,"probability":0.027},{"team":"Þróttur R.","points":1,"probability":0.05025},{"team":"Þróttur R.","points":2,"probability":0.046},{"team":"Þróttur R.","points":3,"probability":0.11975},{"team":"Þróttur R.","points":4,"probability":0.18},{"team":"Þróttur R.","points":5,"probability":0.08075},{"team":"Þróttur R.","points":6,"probability":0.19825},{"team":"Þróttur R.","points":7,"probability":0.16425},{"team":"Þróttur R.","points":9,"probability":0.13375},{"team":"Þór/KA","points":1,"probability":0.169},{"team":"Þór/KA","points":2,"probability":0.17375},{"team":"Þór/KA","points":3,"probability":0.04875},{"team":"Þór/KA","points":4,"probability":0.2445},{"team":"Þór/KA","points":5,"probability":0.1635},{"team":"Þór/KA","points":6,"probability":0.02425},{"team":"Þór/KA","points":7,"probability":0.11425},{"team":"Þór/KA","points":8,"probability":0.04125},{"team":"Þór/KA","points":10,"probability":0.02075}],"summary":[{"team":"Breiðablik","mean_points":10.7555,"median_points":12,"lower_80":9,"upper_80":12,"base_points":3,"p_top_six":0.9975,"p_winner":0.3945,"p_relegation":0.00025},{"team":"Fram","mean_points":1.9975,"median_points":1,"lower_80":0,"upper_80":4,"base_points":0,"p_top_six":0.14975,"p_winner":0,"p_relegation":0.57125},{"team":"Stjarnan","mean_points":3.728,"median_points":4,"lower_80":0,"upper_80":7,"base_points":0,"p_top_six":0.3835,"p_winner":0,"p_relegation":0.319},{"team":"Valur","mean_points":7.948,"median_points":8,"lower_80":4,"upper_80":12,"base_points":3,"p_top_six":0.88975,"p_winner":0.0885,"p_relegation":0.01075},{"team":"Grindavík/Njarðvík","mean_points":3.16875,"median_points":3,"lower_80":0,"upper_80":6,"base_points":0,"p_top_six":0.23725,"p_winner":0,"p_relegation":0.41475},{"team":"Þór/KA","mean_points":3.941,"median_points":4,"lower_80":1,"upper_80":7,"base_points":1,"p_top_six":0.3455,"p_winner":0.0005,"p_relegation":0.33},{"team":"Þróttur R.","mean_points":5.16825,"median_points":5,"lower_80":2,"upper_80":9,"base_points":0,"p_top_six":0.54275,"p_winner":0,"p_relegation":0.1975},{"team":"FH","mean_points":6.43725,"median_points":7,"lower_80":3,"upper_80":10,"base_points":1,"p_top_six":0.707,"p_winner":0.00075,"p_relegation":0.08475},{"team":"ÍBV","mean_points":11.193,"median_points":11,"lower_80":6,"upper_80":16,"base_points":3,"p_top_six":0.946,"p_winner":0.43275,"p_relegation":0.00975},{"team":"Víkingur R.","mean_points":7.68125,"median_points":7,"lower_80":4,"upper_80":12,"base_points":3,"p_top_six":0.801,"p_winner":0.083,"p_relegation":0.062}]}
