{"generated_at":"2026-10-25T17:54:10+0000","season":2026,"records":[{"team":"Dalvík/Reynir","points":31,"probability":1},{"team":"Fjölnir","points":30,"probability":1},{"team":"Haukar","points":47,"probability":1},{"team":"Hvíti riddarinn","points":17,"probability":1},{"team":"KFA","points":29,"probability":1},{"team":"KFG","points":22,"probability":1},{"team":"Kormákur/Hvöt","points":27,"probability":1},{"team":"Kári","points":42,"probability":1},{"team":"Magni","points":25,"probability":1},{"team":"Selfoss","points":45,"probability":1},{"team":"Víkingur Ó.","points":31,"probability":1},{"team":"Þróttur V.","points":23,"probability":1}],"summary":[{"team":"Dalvík/Reynir","mean_points":31,"median_points":31,"lower_80":31,"upper_80":31,"base_points":31,"p_top_six":1,"p_winner":0,"p_relegation":0},{"team":"Fjölnir","mean_points":30,"median_points":30,"lower_80":30,"upper_80":30,"base_points":30,"p_top_six":1,"p_winner":0,"p_relegation":0},{"team":"Haukar","mean_points":47,"median_points":47,"lower_80":47,"upper_80":47,"base_points":47,"p_top_six":1,"p_winner":1,"p_relegation":0},{"team":"Hvíti riddarinn","mean_points":17,"median_points":17,"lower_80":17,"upper_80":17,"base_points":17,"p_top_six":0,"p_winner":0,"p_relegation":1},{"team":"KFA","mean_points":29,"median_points":29,"lower_80":29,"upper_80":29,"base_points":29,"p_top_six":0,"p_winner":0,"p_relegation":0},{"team":"KFG","mean_points":22,"median_points":22,"lower_80":22,"upper_80":22,"base_points":22,"p_top_six":0,"p_winner":0,"p_relegation":1},{"team":"Kormákur/Hvöt","mean_points":27,"median_points":27,"lower_80":27,"upper_80":27,"base_points":27,"p_top_six":0,"p_winner":0,"p_relegation":0},{"team":"Kári","mean_points":42,"median_points":42,"lower_80":42,"upper_80":42,"base_points":42,"p_top_six":1,"p_winner":0,"p_relegation":0},{"team":"Magni","mean_points":25,"median_points":25,"lower_80":25,"upper_80":25,"base_points":25,"p_top_six":0,"p_winner":0,"p_relegation":0},{"team":"Selfoss","mean_points":45,"median_points":45,"lower_80":45,"upper_80":45,"base_points":45,"p_top_six":1,"p_winner":0,"p_relegation":0},{"team":"Víkingur Ó.","mean_points":31,"median_points":31,"lower_80":31,"upper_80":31,"base_points":31,"p_top_six":1,"p_winner":0,"p_relegation":0},{"team":"Þróttur V.","mean_points":23,"median_points":23,"lower_80":23,"upper_80":23,"base_points":23,"p_top_six":0,"p_winner":0,"p_relegation":0}]}
