{"generated_at":"2026-10-12T15:04:47+0000","season":2026,"records":[{"team":"FHL","points":25,"probability":1},{"team":"Grótta","points":41,"probability":1},{"team":"HK","points":30,"probability":1},{"team":"Haukar","points":33,"probability":1},{"team":"KR","points":35,"probability":1},{"team":"Keflavík","points":21,"probability":1},{"team":"Selfoss","points":30,"probability":1},{"team":"Tindastóll","points":3,"probability":1},{"team":"Völsungur","points":15,"probability":1},{"team":"ÍA","points":24,"probability":1}],"summary":[{"team":"FHL","mean_points":25,"median_points":25,"lower_80":25,"upper_80":25,"base_points":25,"p_top_six":1,"p_winner":0,"p_relegation":0},{"team":"Grótta","mean_points":41,"median_points":41,"lower_80":41,"upper_80":41,"base_points":41,"p_top_six":1,"p_winner":1,"p_relegation":0},{"team":"HK","mean_points":30,"median_points":30,"lower_80":30,"upper_80":30,"base_points":30,"p_top_six":1,"p_winner":0,"p_relegation":0},{"team":"Haukar","mean_points":33,"median_points":33,"lower_80":33,"upper_80":33,"base_points":33,"p_top_six":1,"p_winner":0,"p_relegation":0},{"team":"KR","mean_points":35,"median_points":35,"lower_80":35,"upper_80":35,"base_points":35,"p_top_six":1,"p_winner":0,"p_relegation":0},{"team":"Keflavík","mean_points":21,"median_points":21,"lower_80":21,"upper_80":21,"base_points":21,"p_top_six":0,"p_winner":0,"p_relegation":0},{"team":"Selfoss","mean_points":30,"median_points":30,"lower_80":30,"upper_80":30,"base_points":30,"p_top_six":1,"p_winner":0,"p_relegation":0},{"team":"Tindastóll","mean_points":3,"median_points":3,"lower_80":3,"upper_80":3,"base_points":3,"p_top_six":0,"p_winner":0,"p_relegation":1},{"team":"Völsungur","mean_points":15,"median_points":15,"lower_80":15,"upper_80":15,"base_points":15,"p_top_six":0,"p_winner":0,"p_relegation":1},{"team":"ÍA","mean_points":24,"median_points":24,"lower_80":24,"upper_80":24,"base_points":24,"p_top_six":0,"p_winner":0,"p_relegation":0}]}
