{"generated_at":"2026-10-19T16:14:35+0000","season":2026,"records":[{"team":"Augnablik","points":25,"probability":1},{"team":"Höttur","points":29,"probability":1},{"team":"KF","points":27,"probability":1},{"team":"KH","points":44,"probability":1},{"team":"KV","points":30,"probability":1},{"team":"KÁ","points":22,"probability":1},{"team":"Reynir S.","points":42,"probability":1},{"team":"Sindri","points":28,"probability":1},{"team":"Tindastóll","points":42,"probability":1},{"team":"Víðir","points":46,"probability":1},{"team":"Árbær","points":9,"probability":1},{"team":"Ýmir","points":26,"probability":1}],"summary":[{"team":"Augnablik","mean_points":25,"median_points":25,"lower_80":25,"upper_80":25,"base_points":25,"p_top_six":0,"p_winner":0,"p_relegation":0},{"team":"Höttur","mean_points":29,"median_points":29,"lower_80":29,"upper_80":29,"base_points":29,"p_top_six":1,"p_winner":0,"p_relegation":0},{"team":"KF","mean_points":27,"median_points":27,"lower_80":27,"upper_80":27,"base_points":27,"p_top_six":0,"p_winner":0,"p_relegation":0},{"team":"KH","mean_points":44,"median_points":44,"lower_80":44,"upper_80":44,"base_points":44,"p_top_six":1,"p_winner":0,"p_relegation":0},{"team":"KV","mean_points":30,"median_points":30,"lower_80":30,"upper_80":30,"base_points":30,"p_top_six":1,"p_winner":0,"p_relegation":0},{"team":"KÁ","mean_points":22,"median_points":22,"lower_80":22,"upper_80":22,"base_points":22,"p_top_six":0,"p_winner":0,"p_relegation":1},{"team":"Reynir S.","mean_points":42,"median_points":42,"lower_80":42,"upper_80":42,"base_points":42,"p_top_six":1,"p_winner":0,"p_relegation":0},{"team":"Sindri","mean_points":28,"median_points":28,"lower_80":28,"upper_80":28,"base_points":28,"p_top_six":0,"p_winner":0,"p_relegation":0},{"team":"Tindastóll","mean_points":42,"median_points":42,"lower_80":42,"upper_80":42,"base_points":42,"p_top_six":1,"p_winner":0,"p_relegation":0},{"team":"Víðir","mean_points":46,"median_points":46,"lower_80":46,"upper_80":46,"base_points":46,"p_top_six":1,"p_winner":1,"p_relegation":0},{"team":"Árbær","mean_points":9,"median_points":9,"lower_80":9,"upper_80":9,"base_points":9,"p_top_six":0,"p_winner":0,"p_relegation":1},{"team":"Ýmir","mean_points":26,"median_points":26,"lower_80":26,"upper_80":26,"base_points":26,"p_top_six":0,"p_winner":0,"p_relegation":0}]}
